{
  "id": "state-copies-diverge",
  "weakness": "Gates and agents read copies of pull request, check and brief state that disagree with GitHub and with each other.",
  "mechanism": "The merge gate, the checks read, the corner stage and GitHub each hold their own view of the head and its checks. When one lags, an agent is told to act on a state that is no longer true.",
  "evidence": [
    {
      "source": "feedback",
      "text": "Keyword class: 6% of reports in the 7 days to 2026-10-23, up from 2% the 7 days before."
    },
    {
      "source": "feedback",
      "text": "First pass: stale-head, stuck-stage and gate-versus-GitHub reports: 161 in 30 days from 17 agents; 7% of last week's reports, up from 4%."
    },
    {
      "source": "sentry",
      "text": "Unresolved: PR checks HTTP 403 (198 events), check rollup HTTP 502, and a STALE_HEAD verdict rejection."
    },
    {
      "source": "problems",
      "text": "Ranked problem: done reports refused right after a PR opens, before the corner registers it."
    },
    {
      "source": "feedback",
      "text": "The 2026-10-25 Sunday pass found the same weakness on its own: about 111 gate-versus-GitHub reports in 30 days, 71 of them last week."
    },
    {
      "source": "velocity",
      "text": "On 2026-10-23, 11 merged PRs waited 0.8 to 2.7 hours after all checks were green; after the 2026-10-24 gate fixes the wait fell to minutes."
    },
    {
      "source": "feedback",
      "text": "Keyword class rose to 6.5% of reports in the 7 days to 2026-10-25, from 3.2% on 2026-10-21, more than double the 3% target."
    },
    {
      "source": "problems",
      "text": "New ranked problem on 2026-10-26: grant approval cards and wakes name old grants while the current one stays pending, 15 reports from 3 agents, continuing after the 2026-10-25 card fix."
    },
    {
      "source": "problems",
      "text": "New on 2026-10-27: the merge tool reports a closed gate while the checks read reports the merge allowed. Keyword class at 6.3% in the 7 days to 2026-10-26, still about twice the 3% target."
    }
  ],
  "against": [
    "Part of this may be GitHub API errors, not divergence.",
    "The 198-event PR checks 403 burst was one night (2026-10-21) and has not recurred."
  ],
  "prediction": "In a sample of 50 such reports, at least 30 trace to a stored value that differs from GitHub at the time of the call.",
  "falsifiedIf": "Fewer than 20 of 50 sampled reports trace to a stored value that differs from GitHub.",
  "confidence": "high",
  "firstSeen": "2026-10-24",
  "lastReviewed": "2026-10-30",
  "status": "open",
  "track": {
    "label": "Share of reports about stale PR and check state",
    "unit": "share",
    "source": "feedback-share",
    "definition": "Keyword match on the report summary (scripts/theme-classes.mjs): reports naming a stale head, check read or summary, merge or review gate, or a corner or PR not found, as a share of all reports in the 7 days ending that day.",
    "target": {
      "value": 0.03,
      "direction": "above",
      "by": "2026-11-07"
    },
    "history": [
      {
        "date": "2026-09-25",
        "value": null,
        "samples": 0
      },
      {
        "date": "2026-09-26",
        "value": null,
        "samples": 0
      },
      {
        "date": "2026-09-27",
        "value": null,
        "samples": 0
      },
      {
        "date": "2026-09-28",
        "value": null,
        "samples": 0
      },
      {
        "date": "2026-09-29",
        "value": null,
        "samples": 0
      },
      {
        "date": "2026-09-30",
        "value": 0,
        "samples": 41
      },
      {
        "date": "2026-10-01",
        "value": 0.0204,
        "samples": 98
      },
      {
        "date": "2026-10-02",
        "value": 0.0219,
        "samples": 183
      },
      {
        "date": "2026-10-03",
        "value": 0.0253,
        "samples": 237
      },
      {
        "date": "2026-10-04",
        "value": 0.0285,
        "samples": 316
      },
      {
        "date": "2026-10-05",
        "value": 0.0475,
        "samples": 400
      },
      {
        "date": "2026-10-06",
        "value": 0.0446,
        "samples": 448
      },
      {
        "date": "2026-10-07",
        "value": 0.0449,
        "samples": 468
      },
      {
        "date": "2026-10-08",
        "value": 0.0464,
        "samples": 474
      },
      {
        "date": "2026-10-09",
        "value": 0.0501,
        "samples": 419
      },
      {
        "date": "2026-10-10",
        "value": 0.0448,
        "samples": 424
      },
      {
        "date": "2026-10-11",
        "value": 0.0452,
        "samples": 376
      },
      {
        "date": "2026-10-12",
        "value": 0.0202,
        "samples": 346
      },
      {
        "date": "2026-10-13",
        "value": 0.0243,
        "samples": 371
      },
      {
        "date": "2026-10-14",
        "value": 0.0216,
        "samples": 370
      },
      {
        "date": "2026-10-15",
        "value": 0.0158,
        "samples": 379
      },
      {
        "date": "2026-10-16",
        "value": 0.0171,
        "samples": 468
      },
      {
        "date": "2026-10-17",
        "value": 0.0205,
        "samples": 586
      },
      {
        "date": "2026-10-18",
        "value": 0.0194,
        "samples": 670
      },
      {
        "date": "2026-10-19",
        "value": 0.0324,
        "samples": 802
      },
      {
        "date": "2026-10-20",
        "value": 0.0296,
        "samples": 945
      },
      {
        "date": "2026-10-21",
        "value": 0.0319,
        "samples": 1067
      },
      {
        "date": "2026-10-22",
        "value": 0.0365,
        "samples": 1179
      },
      {
        "date": "2026-10-23",
        "value": 0.0594,
        "samples": 1397
      },
      {
        "date": "2026-10-24",
        "value": 0.0599,
        "samples": 1502
      },
      {
        "date": "2026-10-25",
        "value": 0.065,
        "samples": 1585
      },
      {
        "date": "2026-10-26",
        "value": 0.0626,
        "samples": 1502
      },
      {
        "date": "2026-10-27",
        "value": 0.0628,
        "samples": 1466
      },
      {
        "date": "2026-10-28",
        "value": 0.0687,
        "samples": 1471
      },
      {
        "date": "2026-10-29",
        "value": 0.0666,
        "samples": 1576
      }
    ]
  }
}
