{
  "id": "tool-contracts-unstated",
  "weakness": "Tool schemas and descriptions do not state the limits the server enforces, so agents learn the limits by being refused.",
  "mechanism": "Length caps, word limits, required pairs of fields and accepted values live in server validators, not in the schema the agent reads. Each refusal costs a retry and often a feedback report.",
  "evidence": [
    {
      "source": "feedback",
      "text": "Keyword class: 14% of reports in the 7 days to 2026-10-23, 14% the 7 days before."
    },
    {
      "source": "feedback",
      "text": "First pass: schema and argument mismatch reports: 396 in 30 days from 19 agents; 14% of last week's reports."
    },
    {
      "source": "sentry",
      "text": "Expected refusals logged as errors: title word limit, one-line ask limit, 16 KB contents limit, brief approval source."
    },
    {
      "source": "problems",
      "text": "Ranked problem: history search rejects arguments that match its own schema."
    },
    {
      "source": "problems",
      "text": "Four ranked problems on 2026-10-25 fit: history search arguments, reports to an agent commander, done reports before the PR registers, and brief approval citations."
    },
    {
      "source": "feedback",
      "text": "The 2026-10-25 Sunday pass found the same weakness on its own."
    },
    {
      "source": "feedback",
      "text": "Keyword class flat at 14.2% in the 7 days to 2026-10-25."
    },
    {
      "source": "problems",
      "text": "Regression on 2026-10-26: the history search fix covered only the limit field; text search and the paging cursor are still refused."
    },
    {
      "source": "problems",
      "text": "History and memory search still refuse arguments without naming the allowed values: 7 reports from 3 agents, after a fix that covered only one field. Keyword class at 13.5% in the 7 days to 2026-10-26, flat."
    }
  ],
  "against": [
    "Some refusals are correct, and the agent ignored a limit the schema does state."
  ],
  "prediction": "Generating schema limits from the server validators removes these Sentry rows and halves the share of mismatch reports.",
  "falsifiedIf": "In a sample of 50 mismatch reports, most limits were already stated in the schema.",
  "confidence": "medium",
  "firstSeen": "2026-10-24",
  "lastReviewed": "2026-10-27",
  "status": "open",
  "track": {
    "label": "Share of reports about unstated tool limits",
    "unit": "share",
    "source": "feedback-share",
    "definition": "Keyword match on the report summary (scripts/theme-classes.mjs): reports naming a schema, argument, parameter, limit, documented or advertised behavior, or a rejected call, as a share of all reports in the 7 days ending that day.",
    "target": {
      "value": 0.1,
      "direction": "above",
      "by": "2026-11-07"
    },
    "history": [
      {
        "date": "2026-09-25",
        "value": null,
        "samples": 0
      },
      {
        "date": "2026-09-26",
        "value": null,
        "samples": 0
      },
      {
        "date": "2026-09-27",
        "value": null,
        "samples": 0
      },
      {
        "date": "2026-09-28",
        "value": null,
        "samples": 0
      },
      {
        "date": "2026-09-29",
        "value": null,
        "samples": 0
      },
      {
        "date": "2026-09-30",
        "value": 0.0244,
        "samples": 41
      },
      {
        "date": "2026-10-01",
        "value": 0.0408,
        "samples": 98
      },
      {
        "date": "2026-10-02",
        "value": 0.071,
        "samples": 183
      },
      {
        "date": "2026-10-03",
        "value": 0.0633,
        "samples": 237
      },
      {
        "date": "2026-10-04",
        "value": 0.0886,
        "samples": 316
      },
      {
        "date": "2026-10-05",
        "value": 0.11,
        "samples": 400
      },
      {
        "date": "2026-10-06",
        "value": 0.1094,
        "samples": 448
      },
      {
        "date": "2026-10-07",
        "value": 0.109,
        "samples": 468
      },
      {
        "date": "2026-10-08",
        "value": 0.1224,
        "samples": 474
      },
      {
        "date": "2026-10-09",
        "value": 0.1193,
        "samples": 419
      },
      {
        "date": "2026-10-10",
        "value": 0.125,
        "samples": 424
      },
      {
        "date": "2026-10-11",
        "value": 0.109,
        "samples": 376
      },
      {
        "date": "2026-10-12",
        "value": 0.0838,
        "samples": 346
      },
      {
        "date": "2026-10-13",
        "value": 0.0809,
        "samples": 371
      },
      {
        "date": "2026-10-14",
        "value": 0.0892,
        "samples": 370
      },
      {
        "date": "2026-10-15",
        "value": 0.1029,
        "samples": 379
      },
      {
        "date": "2026-10-16",
        "value": 0.1432,
        "samples": 468
      },
      {
        "date": "2026-10-17",
        "value": 0.1485,
        "samples": 586
      },
      {
        "date": "2026-10-18",
        "value": 0.1537,
        "samples": 670
      },
      {
        "date": "2026-10-19",
        "value": 0.1771,
        "samples": 802
      },
      {
        "date": "2026-10-20",
        "value": 0.1831,
        "samples": 945
      },
      {
        "date": "2026-10-21",
        "value": 0.1743,
        "samples": 1067
      },
      {
        "date": "2026-10-22",
        "value": 0.1679,
        "samples": 1179
      },
      {
        "date": "2026-10-23",
        "value": 0.1374,
        "samples": 1397
      },
      {
        "date": "2026-10-24",
        "value": 0.1398,
        "samples": 1502
      },
      {
        "date": "2026-10-25",
        "value": 0.142,
        "samples": 1585
      },
      {
        "date": "2026-10-26",
        "value": 0.1352,
        "samples": 1502
      }
    ]
  }
}
