{
  "id": "loop-hears-only-agents",
  "weakness": "The insights loop hears almost only from agents building Beeline, not from the people using it.",
  "mechanism": "Agents file reports on every refusal; people rarely report. So the ranked list and every theme above measure the build process, while the biggest user drop has no report behind it.",
  "evidence": [
    {
      "source": "feedback",
      "text": "Last week 4 people and 1,433 agent reports; in 30 days 24 human reports from 2 people."
    },
    {
      "source": "snapshot",
      "text": "In the last 7 days, 7 of 18 people who signed up never sent a first message."
    },
    {
      "source": "snapshot",
      "text": "Of 20 people who signed up in the 7 days to 2026-10-22, 10 sent a message within 24 hours and 1 came back the next day."
    },
    {
      "source": "walk",
      "text": "The 2026-10-24 walk recorded 1 stuck person; walk history starts that day."
    },
    {
      "source": "snapshot",
      "text": "Of 19 people who signed up in the 7 days to 2026-10-23, 11 sent a message within 24 hours and 1 came back the next day (5%)."
    },
    {
      "source": "feedback",
      "text": "No human reports since 2026-10-22, against 691 agent reports in the same 3 days."
    },
    {
      "source": "snapshot",
      "text": "Of 17 people who signed up in the 7 days to 2026-10-24, 9 sent a message within 24 hours and 1 came back the next day (6%)."
    },
    {
      "source": "feedback",
      "text": "No human reports for 4 days (since 2026-10-22), against 1,573 agent reports in the last 7 days."
    },
    {
      "source": "snapshot",
      "text": "Paid X ads drew 1,962 link clicks on 2026-10-25, yet Beeline recorded 2 signups in the 24 hours to 09:00 2026-10-26 and no ad-attributed signup. The drop has no report behind it."
    },
    {
      "source": "snapshot",
      "text": "Of 17 people who signed up in the 7 days to 2026-10-25, 10 sent a message within 24 hours and 2 came back the next day (12%, up from 6%). Still no human reports since 2026-10-22, against about 1,500 agent reports in 7 days."
    }
  ],
  "against": [
    "With 19 active people in 28 days, the user data may be too small to show any pattern yet."
  ],
  "prediction": "Watching 5 new signups through their first session finds one shared cause for the missing first message.",
  "falsifiedIf": "The 5 sessions show 5 unrelated causes, or all send a first message.",
  "confidence": "medium",
  "firstSeen": "2026-10-24",
  "lastReviewed": "2026-10-27",
  "status": "open",
  "track": {
    "label": "New people who send a first message within 24 hours",
    "unit": "rate",
    "source": "signup-rate",
    "definition": "Of people (production cohort, no agents) who signed up in the 7 days before that day, the share who sent a message within 24 hours of signing up.",
    "target": {
      "value": 0.75,
      "direction": "below",
      "by": "2026-11-07"
    },
    "history": [
      {
        "date": "2026-09-25",
        "value": null,
        "samples": 0
      },
      {
        "date": "2026-09-26",
        "value": null,
        "samples": 0
      },
      {
        "date": "2026-09-27",
        "value": 0,
        "samples": 1
      },
      {
        "date": "2026-09-28",
        "value": 0.5,
        "samples": 2
      },
      {
        "date": "2026-09-29",
        "value": 0.5,
        "samples": 4
      },
      {
        "date": "2026-09-30",
        "value": 0.4,
        "samples": 5
      },
      {
        "date": "2026-10-01",
        "value": 0.3333,
        "samples": 6
      },
      {
        "date": "2026-10-02",
        "value": 0.25,
        "samples": 8
      },
      {
        "date": "2026-10-03",
        "value": 0.3333,
        "samples": 9
      },
      {
        "date": "2026-10-04",
        "value": 0.375,
        "samples": 8
      },
      {
        "date": "2026-10-05",
        "value": 0.2857,
        "samples": 7
      },
      {
        "date": "2026-10-06",
        "value": 0.2,
        "samples": 5
      },
      {
        "date": "2026-10-07",
        "value": 0.4,
        "samples": 5
      },
      {
        "date": "2026-10-08",
        "value": 0.5,
        "samples": 4
      },
      {
        "date": "2026-10-09",
        "value": 0.6667,
        "samples": 3
      },
      {
        "date": "2026-10-10",
        "value": 0.5,
        "samples": 2
      },
      {
        "date": "2026-10-11",
        "value": 0.5,
        "samples": 2
      },
      {
        "date": "2026-10-12",
        "value": 0.5,
        "samples": 2
      },
      {
        "date": "2026-10-13",
        "value": 0.3333,
        "samples": 3
      },
      {
        "date": "2026-10-14",
        "value": 0,
        "samples": 2
      },
      {
        "date": "2026-10-15",
        "value": 0,
        "samples": 2
      },
      {
        "date": "2026-10-16",
        "value": 0,
        "samples": 1
      },
      {
        "date": "2026-10-17",
        "value": 0,
        "samples": 3
      },
      {
        "date": "2026-10-18",
        "value": 0.4,
        "samples": 5
      },
      {
        "date": "2026-10-19",
        "value": 0.4286,
        "samples": 7
      },
      {
        "date": "2026-10-20",
        "value": 0.5714,
        "samples": 7
      },
      {
        "date": "2026-10-21",
        "value": 0.5556,
        "samples": 9
      },
      {
        "date": "2026-10-22",
        "value": 0.5833,
        "samples": 12
      },
      {
        "date": "2026-10-23",
        "value": 0.5,
        "samples": 20
      },
      {
        "date": "2026-10-24",
        "value": 0.5789,
        "samples": 19
      },
      {
        "date": "2026-10-25",
        "value": 0.5294,
        "samples": 17
      },
      {
        "date": "2026-10-26",
        "value": 0.5882,
        "samples": 17
      }
    ]
  }
}
